project,section,url,description,github,cran
pyfolio-reloaded,Python > Risk Analysis,https://github.com/stefan-jansen/pyfolio-reloaded,Portfolio and risk analytics in Python. [pyfolio](https://github.com/quantopian/pyfolio) fork.,True,False
fortitudo.tech,Python > Risk Analysis,https://github.com/fortitudo-tech/fortitudo.tech,Conditional Value-at-Risk (CVaR) portfolio optimization and Entropy Pooling views / stress-testing in Python.,True,False
quantitative-finance-tools,Python > Risk Analysis,https://github.com/omichauhan-lgtm/quantitative-finance-tools,Library for portfolio optimization (MVO) and rigorous risk metrics (VaR/CVaR).,True,False
alphalens,Python > Factor Analysis,https://github.com/quantopian/alphalens,Performance analysis of predictive alpha factors.,True,False
alphalens-reloaded,Python > Factor Analysis,https://github.com/stefan-jansen/alphalens-reloaded,Performance analysis of predictive (alpha) stock factors.,True,False
Spectre,Python > Factor Analysis,https://github.com/Heerozh/spectre,GPU-accelerated Factors analysis library and Backtester,True,False
Asset News Sentiment Analyzer,Python > Sentiment Analysis,https://github.com/KVignesh122/AssetNewsSentimentAnalyzer,Sentiment analysis and report generation package for financial assets and securities utilizing GPT models.,True,False
Jupyter Quant,Python > Quant Research Environment,https://github.com/gnzsnz/jupyter-quant,"A dockerized Jupyter quant research environment with preloaded tools for quant analysis, statsmodels, pymc, arch, py_vollib, zipline-reloaded, PyPortfolioOpt, etc.",True,False
ARCH,Python > Time Series,https://github.com/bashtage/arch,ARCH models in Python.,True,False
statsmodels,Python > Time Series,http://statsmodels.sourceforge.net,"Python module that allows users to explore data, estimate statistical models, and perform statistical tests.",False,False
dynts,Python > Time Series,https://github.com/quantmind/dynts,Python package for timeseries analysis and manipulation.,True,False
PyFlux,Python > Time Series,https://github.com/RJT1990/pyflux,Python library for timeseries modelling and inference (frequentist and Bayesian) on models.,True,False
tsfresh,Python > Time Series,https://github.com/blue-yonder/tsfresh,Automatic extraction of relevant features from time series.,True,False
hasura/quandl-metabase,Python > Time Series,https://platform.hasura.io/hub/projects/anirudhm/quandl-metabase-time-series,Hasura quickstart to visualize Quandl's timeseries datasets with Metabase.,False,False
Facebook Prophet,Python > Time Series,https://github.com/facebook/prophet,Tool for producing high quality forecasts for time series data that has multiple seasonality with linear or non-linear growth.,True,False
tsmoothie,Python > Time Series,https://github.com/cerlymarco/tsmoothie,A python library for time-series smoothing and outlier detection in a vectorized way.,True,False
pmdarima,Python > Time Series,https://github.com/alkaline-ml/pmdarima,"A statistical library designed to fill the void in Python's time series analysis capabilities, including the equivalent of R's auto.arima function.",True,False
gluon-ts,Python > Time Series,https://github.com/awslabs/gluon-ts,vProbabilistic time series modeling in Python.,True,False
functime,Python > Time Series,https://github.com/functime-org/functime,Time-series machine learning at scale. Built with Polars for embarrassingly parallel feature extraction and forecasts on panel data.,True,False
exchange_calendars,Python > Calendars,https://github.com/gerrymanoim/exchange_calendars,Stock Exchange Trading Calendars.,True,False
bizdays,Python > Calendars,https://github.com/wilsonfreitas/python-bizdays,Business days calculations and utilities.,True,False
pandas_market_calendars,Python > Calendars,https://github.com/rsheftel/pandas_market_calendars,Exchange calendars to use with pandas for trading applications.,True,False
yfinance,Python > Data Sources,https://github.com/ranaroussi/yfinance,Yahoo! Finance market data downloader (+faster Pandas Datareader),True,False
defeatbeta-api,Python > Data Sources,https://github.com/defeat-beta/defeatbeta-api,An open-source alternative to Yahoo Finance's market data APIs with higher reliability.,True,False
findatapy,Python > Data Sources,https://github.com/cuemacro/findatapy,"Python library to download market data via Bloomberg, Quandl, Yahoo etc.",True,False
googlefinance,Python > Data Sources,https://github.com/hongtaocai/googlefinance,Python module to get real-time stock data from Google Finance API.,True,False
yahoo-finance,Python > Data Sources,https://github.com/lukaszbanasiak/yahoo-finance,Python module to get stock data from Yahoo! Finance.,True,False
pandas-datareader,Python > Data Sources,https://github.com/pydata/pandas-datareader,"Python module to get data from various sources (Google Finance, Yahoo Finance, FRED, OECD, Fama/French, World Bank, Eurostat...) into Pandas datastructures such as DataFrame, Panel with a caching mechanism.",True,False
pandas-finance,Python > Data Sources,https://github.com/davidastephens/pandas-finance,High level API for access to and analysis of financial data.,True,False
pyhoofinance,Python > Data Sources,https://github.com/innes213/pyhoofinance,Rapidly queries Yahoo Finance for multiple tickers and returns typed data for analysis.,True,False
yfinanceapi,Python > Data Sources,https://github.com/Karthik005/yfinanceapi,Finance API for Python.,True,False
yql-finance,Python > Data Sources,https://github.com/slawek87/yql-finance,"yql-finance is simple and fast. API returns stock closing prices for current period of time and current stock ticker (i.e. APPL, GOOGL).",True,False
ystockquote,Python > Data Sources,https://github.com/cgoldberg/ystockquote,Retrieve stock quote data from Yahoo Finance.,True,False
wallstreet,Python > Data Sources,https://github.com/mcdallas/wallstreet,Real time stock and option data.,True,False
stock_extractor,Python > Data Sources,https://github.com/ZachLiuGIS/stock_extractor,General Purpose Stock Extractors from Online Resources.,True,False
Stockex,Python > Data Sources,https://github.com/cttn/Stockex,Python wrapper for Yahoo! Finance API.,True,False
finsymbols,Python > Data Sources,https://github.com/skillachie/finsymbols,"Obtains stock symbols and relating information for SP500, AMEX, NYSE, and NASDAQ.",True,False
FRB,Python > Data Sources,https://github.com/avelkoski/FRB,Python Client for FRED® API.,True,False
inquisitor,Python > Data Sources,https://github.com/econdb/inquisitor,Python Interface to Econdb.com API.,True,False
yfi,Python > Data Sources,https://github.com/nickelkr/yfi,Yahoo! YQL library.,True,False
chinesestockapi,Python > Data Sources,https://pypi.org/project/chinesestockapi/,Python API to get Chinese stock price.,False,False
exchange,Python > Data Sources,https://github.com/akarat/exchange,Get current exchange rate.,True,False
ticks,Python > Data Sources,https://github.com/jamescnowell/ticks,Simple command line tool to get stock ticker data.,True,False
pybbg,Python > Data Sources,https://github.com/bpsmith/pybbg,Python interface to Bloomberg COM APIs.,True,False
ccy,Python > Data Sources,https://github.com/lsbardel/ccy,Python module for currencies.,True,False
tushare,Python > Data Sources,https://pypi.org/project/tushare/,A utility for crawling historical and Real-time Quotes data of China stocks.,False,False
jsm,Python > Data Sources,https://pypi.org/project/jsm/,Get the japanese stock market data.,False,False
cn_stock_src,Python > Data Sources,https://github.com/jealous/cn_stock_src,Utility for retrieving basic China stock data from different sources.,True,False
coinmarketcap,Python > Data Sources,https://github.com/barnumbirr/coinmarketcap,Python API for coinmarketcap.,True,False
after-hours,Python > Data Sources,https://github.com/datawrestler/after-hours,Obtain pre market and after hours stock prices for a given symbol.,True,False
bronto-python,Python > Data Sources,https://pypi.org/project/bronto-python/,Bronto API Integration for Python.,False,False
pytdx,Python > Data Sources,https://github.com/rainx/pytdx,Python Interface for retrieving chinese stock realtime quote data from TongDaXin Nodes.,True,False
pdblp,Python > Data Sources,https://github.com/matthewgilbert/pdblp,A simple interface to integrate pandas and the Bloomberg Open API.,True,False
tiingo,Python > Data Sources,https://github.com/hydrosquall/tiingo-python,"Python interface for daily composite prices/OHLC/Volume + Real-time News Feeds, powered by the Tiingo Data Platform.",True,False
iexfinance,Python > Data Sources,https://github.com/addisonlynch/iexfinance,Python Interface for retrieving real-time and historical prices and equities data from The Investor's Exchange.,True,False
pyEX,Python > Data Sources,https://github.com/timkpaine/pyEX,"Python interface to IEX with emphasis on pandas, support for streaming data, premium data, points data (economic, rates, commodities), and technical indicators.",True,False
alpaca-trade-api,Python > Data Sources,https://github.com/alpacahq/alpaca-trade-api-python,Python interface for retrieving real-time and historical prices from Alpaca API as well as trade execution.,True,False
metatrader5,Python > Data Sources,https://pypi.org/project/MetaTrader5/,API Connector to MetaTrader 5 Terminal,False,False
akshare,Python > Data Sources,https://github.com/jindaxiang/akshare,"AkShare is an elegant and simple financial data interface library for Python, built for human beings! <https://akshare.readthedocs.io>",True,False
yahooquery,Python > Data Sources,https://github.com/dpguthrie/yahooquery,Python interface for retrieving data through unofficial Yahoo Finance API.,True,False
investpy,Python > Data Sources,https://github.com/alvarobartt/investpy,Financial Data Extraction from Investing.com with Python! <https://investpy.readthedocs.io/>,True,False
yliveticker,Python > Data Sources,https://github.com/yahoofinancelive/yliveticker,Live stream of market data from Yahoo Finance websocket.,True,False
bbgbridge,Python > Data Sources,https://github.com/ran404/bbgbridge,Easy to use Bloomberg Desktop API wrapper for Python.,True,False
polygon.io,Python > Data Sources,https://github.com/polygon-io/client-python,A python library for Polygon.io financial data APIs.,True,False
alpha_vantage,Python > Data Sources,https://github.com/RomelTorres/alpha_vantage,A python wrapper for Alpha Vantage API for financial data.,True,False
oilpriceapi,Python > Data Sources,https://github.com/OilpriceAPI/python-sdk,"Python SDK for real-time oil and commodity prices (WTI, Brent, Urals, natural gas, coal) with OpenBB integration.",True,False
FinanceDataReader,Python > Data Sources,https://github.com/FinanceData/FinanceDataReader,"Open Source Financial data reader for U.S, Korean, Japanese, Chinese, Vietnamese Stocks",True,False
pystlouisfed,Python > Data Sources,https://github.com/TomasKoutek/pystlouisfed,"Python client for Federal Reserve Bank of St. Louis API - FRED, ALFRED, GeoFRED and FRASER.",True,False
python-bcb,Python > Data Sources,https://github.com/wilsonfreitas/python-bcb,Python interface to Brazilian Central Bank web services.,True,False
market-prices,Python > Data Sources,https://github.com/maread99/market_prices,Create meaningful OHLCV datasets from knowledge of [exchange-calendars](https://github.com/gerrymanoim/exchange_calendars) (works out-the-box with data from Yahoo Finance).,True,False
tardis-python,Python > Data Sources,https://github.com/tardis-dev/tardis-python,Python interface for Tardis.dev high frequency crypto market data,True,False
lake-api,Python > Data Sources,https://github.com/crypto-lake/lake-api,Python interface for Crypto Lake high frequency crypto market data,True,False
tessa,Python > Data Sources,https://github.com/ymyke/tessa,"simple, hassle-free access to price information of financial assets (currently based on yfinance and pycoingecko), including search and a symbol class.",True,False
pandaSDMX,Python > Data Sources,https://github.com/dr-leo/pandaSDMX,"Python package that implements SDMX 2.1 (ISO 17369:2013), a format for exchange of statistical data and metadata used by national statistical agencies, central banks, and international organisations.",True,False
cif,Python > Data Sources,https://github.com/LenkaV/CIF,"Python package that include few composite indicators, which summarize multidimensional relationships between individual economic indicators.",True,False
finagg,Python > Data Sources,https://github.com/theOGognf/finagg,"finagg is a Python package that provides implementations of popular and free financial APIs, tools for aggregating historical data from those APIs into SQL databases, and tools for transforming aggregated data into features useful for analysis and AI/ML.",True,False
FinanceDatabase,Python > Data Sources,https://github.com/JerBouma/FinanceDatabase,"This is a database of 300.000+ symbols containing Equities, ETFs, Funds, Indices, Currencies, Cryptocurrencies and Money Markets.",True,False
Trading Strategy,Python > Data Sources,https://github.com/tradingstrategy-ai/trading-strategy/,download price data for decentralised exchanges and lending protocols (DeFi),True,False
datamule-python,Python > Data Sources,https://github.com/john-friedman/datamule-python,A package to work with SEC data. Incorporates datamule endpoints.,True,False
Earnings Feed,Python > Data Sources,https://earningsfeed.com/api,"Real-time SEC filings, insider trades, and institutional holdings API.",False,False
Financial Data,Python > Data Sources,https://financialdata.net/,Stock Market and Financial Data API.,False,False
SaxoOpenAPI,Python > Data Sources,https://www.developer.saxo/,Saxo Bank financial data API.,False,False
fsynth,Python > Data Sources,https://github.com/welcra/fsynth,Python library for high-fidelity unlimited synthetic financial data generation using Heston Stochastic Volatility and Merton Jump Diffusion.,True,False
fedfred,Python > Data Sources,https://nikhilxsunder.github.io/fedfred/,"FRED & GeoFRED Economic data API with preprocessed dataframe output in pandas/geopandas, polars/polars_st, and dask dataframes/geodataframes.",False,False
edgar-sec,Python > Data Sources,https://nikhilxsunder.github.io/edgar-sec/,EDGAR Financial data API with preprocessed dataclass outputs.,False,False
xlwings,Python > Excel Integration,https://www.xlwings.org/,Make Excel fly with Python.,False,False
openpyxl,Python > Excel Integration,https://openpyxl.readthedocs.io/en/latest/,Read/Write Excel 2007 xlsx/xlsm files.,False,False
xlrd,Python > Excel Integration,https://github.com/python-excel/xlrd,Library for developers to extract data from Microsoft Excel spreadsheet files.,True,False
xlsxwriter,Python > Excel Integration,https://xlsxwriter.readthedocs.io/,Write files in the Excel 2007+ XLSX file format.,False,False
xlwt,Python > Excel Integration,https://github.com/python-excel/xlwt,"Library to create spreadsheet files compatible with MS Excel 97/2000/XP/2003 XLS files, on any platform.",True,False
DataNitro,Python > Excel Integration,https://datanitro.com/,"DataNitro also offers full-featured Python-Excel integration, including UDFs. Trial downloads are available, but users must purchase a license.",False,False
xlloop,Python > Excel Integration,http://xlloop.sourceforge.net,XLLoop is an open source framework for implementing Excel user-defined functions (UDFs) on a centralised server (a function server).,False,False
expy,Python > Excel Integration,http://www.bnikolic.co.uk/expy/expy.html,"The ExPy add-in allows easy use of Python directly from within an Microsoft Excel spreadsheet, both to execute arbitrary code and to define new Excel functions.",False,False
pyxll,Python > Excel Integration,https://www.pyxll.com,PyXLL is an Excel add-in that enables you to extend Excel using nothing but Python code.,False,False
D-Tale,Python > Visualization,https://github.com/man-group/dtale,Visualizer for pandas dataframes and xarray datasets.,True,False
mplfinance,Python > Visualization,https://github.com/matplotlib/mplfinance,"matplotlib utilities for the visualization, and visual analysis, of financial data.",True,False
finplot,Python > Visualization,https://github.com/highfestiva/finplot,Performant and effortless finance plotting for Python.,True,False
finvizfinance,Python > Visualization,https://github.com/lit26/finvizfinance,Finviz analysis python library.,True,False
market-analy,Python > Visualization,https://github.com/maread99/market_analy,Analysis and interactive charting using [market-prices](https://github.com/maread99/market_prices) and bqplot.,True,False
QuantInvestStrats,Python > Visualization,https://github.com/ArturSepp/QuantInvestStrats,"Quantitative Investment Strategies (QIS) package implements Python analytics for visualisation of financial data, performance reporting, analysis of quantitative strategies.",True,False
xts,R > Numerical Libraries & Data Structures,https://github.com/joshuaulrich/xts,"eXtensible Time Series: Provide for uniform handling of R's different time-based data classes by extending zoo, maximizing native format information preservation and allowing for user level customization and extension, while simplifying cross-class interoperability.",True,False
data.table,R > Numerical Libraries & Data Structures,https://github.com/Rdatatable/data.table,"Extension of data.frame: Fast aggregation of large data (e.g. 100GB in RAM), fast ordered joins, fast add/modify/delete of columns by group using no copies at all, list columns and a fast file reader (fread). Offers a natural and flexible syntax, for faster development.",True,False
sparseEigen,R > Numerical Libraries & Data Structures,https://github.com/dppalomar/sparseEigen,Sparse principal component analysis.,True,False
TSdbi,R > Numerical Libraries & Data Structures,http://tsdbi.r-forge.r-project.org/,Provides a common interface to time series databases.,False,False
tseries,R > Numerical Libraries & Data Structures,https://cran.r-project.org/web/packages/tseries/index.html,Time Series Analysis and Computational Finance.,False,True
zoo,R > Numerical Libraries & Data Structures,https://cran.r-project.org/web/packages/zoo/index.html,S3 Infrastructure for Regular and Irregular Time Series (Z's Ordered Observations).,False,True
tis,R > Numerical Libraries & Data Structures,https://cran.r-project.org/web/packages/tis/index.html,"Functions and S3 classes for time indexes and time indexed series, which are compatible with FAME frequencies.",False,True
tfplot,R > Numerical Libraries & Data Structures,https://cran.r-project.org/web/packages/tfplot/index.html,Utilities for simple manipulation and quick plotting of time series data.,False,True
tframe,R > Numerical Libraries & Data Structures,https://cran.r-project.org/web/packages/tframe/index.html,A kernel of functions for programming time series methods in a way that is relatively independently of the representation of time.,False,True
IBrokers,R > Data Sources,https://cran.r-project.org/web/packages/IBrokers/index.html,Provides native R access to Interactive Brokers Trader Workstation API.,False,True
Rblpapi,R > Data Sources,https://github.com/Rblp/Rblpapi,An R Interface to 'Bloomberg' is provided via the 'Blp API'.,True,False
Quandl,R > Data Sources,https://www.quandl.com/tools/r,Get Financial Data Directly Into R.,False,False
Rbitcoin,R > Data Sources,https://github.com/jangorecki/Rbitcoin,"Unified markets API interface (bitstamp, kraken, btce, bitmarket).",True,False
GetTDData,R > Data Sources,https://github.com/msperlin/GetTDData,Downloads and aggregates data for Brazilian government issued bonds directly from the website of Tesouro Direto.,True,False
GetHFData,R > Data Sources,https://github.com/msperlin/GetHFData,Downloads and aggregates high frequency trading data for Brazilian instruments directly from Bovespa ftp site.,True,False
Reddit WallstreetBets API,R > Data Sources,https://dashboard.nbshare.io/apps/reddit/api/,Provides daily top 50 stocks from reddit (subreddit) Wallstreetbets and their sentiments via the API.,False,False
td,R > Data Sources,https://github.com/eddelbuettel/td,Interfaces the 'twelvedata' API for stocks and (digital and standard) currencies.,True,False
rbcb,R > Data Sources,https://github.com/wilsonfreitas/rbcb,R interface to Brazilian Central Bank web services.,True,False
rb3,R > Data Sources,https://github.com/ropensci/rb3,A bunch of downloaders and parsers for data delivered from B3.,True,False
simfinapi,R > Data Sources,https://github.com/matthiasgomolka/simfinapi,Makes 'SimFin' data (<https://simfin.com/>) easily accessible in R.,True,False
tidyfinance,R > Data Sources,https://github.com/tidy-finance/r-tidyfinance,"Tidy Finance helper functions to download financial data and process the raw data into a structured Format (tidy data), including",True,False
RQuantLib,R > Financial Instruments and Pricing,https://github.com/eddelbuettel/rquantlib,RQuantLib connects GNU R with QuantLib.,True,False
quantmod,R > Financial Instruments and Pricing,https://cran.r-project.org/web/packages/quantmod/index.html,Quantitative Financial Modelling Framework.,False,True
Rmetrics,R > Financial Instruments and Pricing,https://www.rmetrics.org,The premier open source software solution for teaching and training quantitative finance.,False,False
fAsianOptions,R > Financial Instruments and Pricing,https://cran.r-project.org/web/packages/fAsianOptions/index.html,EBM and Asian Option Valuation.,False,True
fAssets,R > Financial Instruments and Pricing,https://cran.r-project.org/web/packages/fAssets/index.html,Analysing and Modelling Financial Assets.,False,True
fBasics,R > Financial Instruments and Pricing,https://cran.r-project.org/web/packages/fBasics/index.html,Markets and Basic Statistics.,False,True
fBonds,R > Financial Instruments and Pricing,https://cran.r-project.org/web/packages/fBonds/index.html,Bonds and Interest Rate Models.,False,True
fExoticOptions,R > Financial Instruments and Pricing,https://cran.r-project.org/web/packages/fExoticOptions/index.html,Exotic Option Valuation.,False,True
fOptions,R > Financial Instruments and Pricing,https://cran.r-project.org/web/packages/fOptions/index.html,Pricing and Evaluating Basic Options.,False,True
fPortfolio,R > Financial Instruments and Pricing,https://cran.r-project.org/web/packages/fPortfolio/index.html,Portfolio Selection and Optimization.,False,True
portfolio,R > Financial Instruments and Pricing,https://github.com/dgerlanc/portfolio,Analysing equity portfolios.,True,False
sparseIndexTracking,R > Financial Instruments and Pricing,https://github.com/dppalomar/sparseIndexTracking,Portfolio design to track an index.,True,False
covFactorModel,R > Financial Instruments and Pricing,https://github.com/dppalomar/covFactorModel,Covariance matrix estimation via factor models.,True,False
riskParityPortfolio,R > Financial Instruments and Pricing,https://github.com/dppalomar/riskParityPortfolio,Blazingly fast design of risk parity portfolios.,True,False
sde,R > Financial Instruments and Pricing,https://cran.r-project.org/web/packages/sde/index.html,Simulation and Inference for Stochastic Differential Equations.,False,True
YieldCurve,R > Financial Instruments and Pricing,https://cran.r-project.org/web/packages/YieldCurve/index.html,Modelling and estimation of the yield curve.,False,True
SmithWilsonYieldCurve,R > Financial Instruments and Pricing,https://cran.r-project.org/web/packages/SmithWilsonYieldCurve/index.html,Constructs a yield curve by the Smith-Wilson method from a table of LIBOR and SWAP rates.,False,True
ycinterextra,R > Financial Instruments and Pricing,https://cran.r-project.org/web/packages/ycinterextra/index.html,Yield curve or zero-coupon prices interpolation and extrapolation.,False,True
AmericanCallOpt,R > Financial Instruments and Pricing,https://cran.r-project.org/web/packages/AmericanCallOpt/index.html,This package includes pricing function for selected American call options with underlying assets that generate payouts.,False,True
VarSwapPrice,R > Financial Instruments and Pricing,https://cran.r-project.org/web/packages/VarSwapPrice/index.html,Pricing a variance swap on an equity index.,False,True
RND,R > Financial Instruments and Pricing,https://cran.r-project.org/web/packages/RND/index.html,Risk Neutral Density Extraction Package.,False,True
LSMonteCarlo,R > Financial Instruments and Pricing,https://cran.r-project.org/web/packages/LSMonteCarlo/index.html,American options pricing with Least Squares Monte Carlo method.,False,True
OptHedging,R > Financial Instruments and Pricing,https://cran.r-project.org/web/packages/OptHedging/index.html,Estimation of value and hedging strategy of call and put options.,False,True
tvm,R > Financial Instruments and Pricing,https://cran.r-project.org/web/packages/tvm/index.html,Time Value of Money Functions.,False,True
OptionPricing,R > Financial Instruments and Pricing,https://cran.r-project.org/web/packages/OptionPricing/index.html,Option Pricing with Efficient Simulation Algorithms.,False,True
credule,R > Financial Instruments and Pricing,https://github.com/blenezet/credule,Credit Default Swap Functions.,True,False
derivmkts,R > Financial Instruments and Pricing,https://cran.r-project.org/web/packages/derivmkts/index.html,Functions and R Code to Accompany Derivatives Markets.,False,True
FinCal,R > Financial Instruments and Pricing,https://github.com/felixfan/FinCal,"Package for time value of money calculation, time series analysis and computational finance.",True,False
r-quant,R > Financial Instruments and Pricing,https://github.com/artyyouth/r-quant,R code for quantitative analysis in finance.,True,False
options.studies,R > Financial Instruments and Pricing,https://github.com/taylorizing/options.studies,options trading studies functions for use with options.data package and shiny.,True,False
