project,section,url,description,github,cran
book_irds3,"Reproducing Works, Training & Books",https://github.com/attack68/book_irds3,Code repository for Pricing and Trading Interest Rate Derivatives.,True,False
Autoencoder-Asset-Pricing-Models,"Reproducing Works, Training & Books",https://github.com/RichardS0268/Autoencoder-Asset-Pricing-Models,"Reimplementation of Autoencoder Asset Pricing Models ([GKX, 2019](https://papers.ssrn.com/sol3/papers.cfm?abstract_id=3335536)).",True,False
Finance,"Reproducing Works, Training & Books",https://github.com/shashankvemuri/Finance,"150+ quantitative finance Python programs to help you gather, manipulate, and analyze stock market data.",True,False
101_formulaic_alphas,"Reproducing Works, Training & Books",https://github.com/ram-ki/101_formulaic_alphas,Implementation of [101 formulaic alphas](https://arxiv.org/ftp/arxiv/papers/1601/1601.00991.pdf) using qstrader.,True,False
Tidy Finance,"Reproducing Works, Training & Books",https://www.tidy-finance.org/,"An opinionated approach to empirical research in financial economics - a fully transparent, open-source code base in multiple programming languages (Python and R) to enable the reproducible implementation of financial research projects for students and practitioners.",False,False
RoughVolatilityWorkshop,"Reproducing Works, Training & Books",https://github.com/jgatheral/RoughVolatilityWorkshop,2024 QuantMind's Rough Volatility Workshop lectures.,True,False
AFML,"Reproducing Works, Training & Books",https://github.com/boyboi86/AFML,All the answers for exercises from Advances in Financial Machine Learning by Dr Marco Lopez de Parodo.,True,False
AlgoTradingLib,"Reproducing Works, Training & Books",https://github.com/usdaud/algotradinglib.github.io,"A catalog of algorithmic trading libraries, frameworks, strategies, and educational materials.",True,False
